{
  "$schema": "schema/video_log_process_metadata.schema.json",
  "artifact": "log_process_metadata",
  "student_id": "Helena",
  "cohort_year": 2026,
  "schema_version": "1.0",
  "generated_at": "2026-07-21T11:23:37.945909+00:00",
  "log_available": false,
  "log_file_id": null,
  "interpretation_rule": "Task-4 variables are null when event log is unavailable. Do not infer log-only chronology from video; use expert narrative and V-layer process codes with lowered confidence where needed.",
  "modality_coverage": {
    "video": true,
    "expert_narrative": true,
    "audio_transcript": false,
    "event_log": false
  },
  "video_cannot_determine": [
    "metric_interpretation_quality_emit_is_not_inspection",
    "graph_reading_intent_and_cross_representation_use",
    "threshold_reasoning_intent",
    "class_label_semantics_understanding",
    "train_test_role_awareness_without_visible_cues",
    "threshold_transfer_reasoning",
    "comparative_model_evaluation_rationale",
    "integrated_metric_decision_rationale",
    "negative_evidence_no_metric_panel_inspection",
    "negative_evidence_no_graph_reading_despite_opportunity",
    "assistance_agency_peer_vs_instructor_vs_independent",
    "off_task_engagement_and_attention",
    "cognitive_load_hesitation_disorientation",
    "misconception_reasoning_vs_logged_values_alone",
    "verbatim_justification_and_argumentation"
  ],
  "log_can_corroborate": [
    "session_start_and_data_context",
    "target_selection_chronology",
    "predictor_drop_attribute_chronology",
    "threshold_change_chronology",
    "emit_presence_and_timing",
    "tree_depth_at_emit",
    "action_counts_and_timing",
    "model_configuration_at_emit",
    "train_test_dataset_switch_chronology",
    "tree_rebuild_and_refresh_events"
  ],
  "task4_process_variables": {
    "time_to_first_target_ms": null,
    "time_to_first_split_ms": null,
    "time_to_first_emit_ms": null,
    "feature_change_count": null,
    "unique_features_tried": null,
    "threshold_change_count": null,
    "unique_thresholds_tried": null,
    "emit_count": null,
    "valid_emit_count": null,
    "max_tree_depth": null,
    "depth2_attempts": null,
    "tree_rebuild_count": null,
    "dataset_switch_count": null,
    "comparison_cycles": null,
    "undo_count": null,
    "session_duration_minutes": null,
    "train_test_applied": null,
    "train_test_accuracy_gap": null,
    "exploration_index": null,
    "log_available_flag": false,
    "sync_error_ms": null,
    "frame_coverage_ratio": null
  },
  "log_derived_features": null,
  "log_behavior_presence": null,
  "video_log_sync": {
    "status": "unavailable",
    "method": null,
    "sync_error_ms": null,
    "critical_events_covered": null,
    "critical_events_total": null,
    "events_beyond_video_end": 0,
    "note": "No CODAP event CSV for 2026 cohort. Video duration ~None min when known."
  },
  "analyst_flags": [
    "no_event_log_for_cohort"
  ]
}
